{
  "schema_version": "v1alpha1",
  "adapter_id": "langgraph",
  "adapter_name": "Guild LangGraph Adapter",
  "package": "@guild/adapter-langgraph",
  "profile": "adapter-alpha",
  "orchestrator": "LangGraph",
  "capabilities": [
    "taskpack.create",
    "dri.assign",
    "artifact.publish",
    "state.patch"
  ],
  "required_checks": [
    "schemas.closed",
    "taskpack.valid",
    "dri.single_owner",
    "artifact.provenance",
    "tests.local"
  ],
  "badge": {
    "label": "Guild adapter-alpha",
    "url": "../badges/guild-adapter-alpha.svg"
  }
}
